{
  "name": "DeepSeek-V4-Flash-0731（专属镜像 · v0.26.0 主路径）",
  "description": "DeepSeek-V4-Flash-0731 专属镜像 + 双节点 TP=2 vLLM 服务（本地源码编译：主流 vLLM v0.26.0 + Anemll 式 GB10 定向 overlay；InstantTensor 加载 + dspark 投机 MTP；KV=fp8_ds_mla；MoE 走 auto(DeepGEMM) 原生路径——真机验证 b12x 的 prefill 路径在 v0.26.0 集成下不可用(~88 tok/s)，auto 为 2200+ tok/s）。镜像为每模型专属（构建期烘培 hybrid-draft-loader 补丁与调优 ENV），不需要运行时 apply-mod。发布时选集群/head/worker，模型经 Fireworks 模型管理分发到各节点 HF 缓存后离线加载。",
  "image": "fireworks-models/deepseek-v4-flash-0731:0.3.1",
  "compose_template": "services:\n  vllm-b12x:\n    image: ${VLLM_IMAGE:-fireworks-models/deepseek-v4-flash-0731:0.3.1}\n    container_name: ${TASK_NAME}-rank${NODE_RANK}\n    pull_policy: if_not_present\n    entrypoint: []\n    network_mode: host\n    ipc: host\n    shm_size: \"64gb\"\n    ulimits:\n      memlock: -1\n      stack: 67108864\n    gpus: all\n    devices:\n      - /dev/infiniband:/dev/infiniband\n    volumes:\n      - ${HF_CACHE:-${HOME}/.cache/huggingface}:/cache/huggingface\n      - ${HOME}/.cache/vllm-cache:/cache/vllm-cache\n      - ${HOME}/.cache/dspark-tmp:/tmp\n    environment:\n      HF_HOME: /cache/huggingface\n      HF_HUB_OFFLINE: \"1\"\n      HF_HUB_DISABLE_XET: \"1\"\n      VLLM_CACHE_ROOT: /cache/vllm-cache\n      DG_JIT_CACHE_DIR: /tmp/deep-gemm\n      VLLM_ALLOW_LONG_MAX_MODEL_LEN: \"1\"\n      TILELANG_CLEANUP_TEMP_FILES: \"1\"\n      TILELANG_CACHE_DIR: \"/cache/vllm-cache/tilelang\"\n      TRITON_CACHE_DIR: \"/cache/vllm-cache/triton\"\n      VLLM_EXECUTE_MODEL_TIMEOUT_SECONDS: \"3600\"\n      VLLM_USE_BREAKABLE_CUDAGRAPH: \"0\"\n      VLLM_HOST_IP: \"${VLLM_HOST_IP:-}\"\n      PYTORCH_CUDA_ALLOC_CONF: expandable_segments:True\n      NCCL_IB_HCA: \"${NCCL_IB_HCA:-}\"\n      NCCL_SOCKET_IFNAME: \"${NCCL_SOCKET_IFNAME:-}\"\n      NCCL_IB_GID_INDEX: \"${NCCL_IB_GID_INDEX:-}\"\n      NCCL_IB_GID_AUTO: \"1\"\n      NCCL_IB_ADDR_FAMILY: AF_INET\n      NCCL_IB_ROCE_VERSION_NUM: 2\n      NCCL_IB_DISABLE: \"0\"\n      NCCL_CROSS_NIC: \"1\"\n      NCCL_NVLS_ENABLE: \"0\"\n      NCCL_CUMEM_ENABLE: \"0\"\n      NCCL_IGNORE_CPU_AFFINITY: \"1\"\n      NCCL_DEBUG: WARN\n    command:\n      - bash\n      - -lc\n      - >\n        export PATH=\"/usr/local/cuda/bin:/usr/local/bin:$${PATH:-}\";\n        export CUDA_HOME=\"$${CUDA_HOME:-/usr/local/cuda}\";\n        export CUDA_PATH=\"$${CUDA_PATH:-$${CUDA_HOME}}\";\n        export LD_LIBRARY_PATH=\"/usr/local/cuda/lib64:$${LD_LIBRARY_PATH:-}\";\n        if [ -d /opt/fw/vllm-cache-seed ] && [ -n \"$(ls -A /opt/fw/vllm-cache-seed)\" ]; then\n          mkdir -p /cache/vllm-cache && cp -an /opt/fw/vllm-cache-seed/. /cache/vllm-cache/;\n          echo \"[fw] vllm-cache seed seeded from image\";\n        fi;\n        exec vllm serve ${DSPARK_MODEL:-deepseek-ai/DeepSeek-V4-Flash-0731}\n        --served-model-name ${SERVED_MODEL_NAME:-deepseek-v4-flash-0731}\n        --host 0.0.0.0\n        --port ${VLLM_PORT:-8000}\n        --trust-remote-code\n        --tensor-parallel-size ${TENSOR_PARALLEL_SIZE:-2}\n        --kv-cache-dtype ${KV_CACHE_DTYPE:-nvfp4_ds_mla}\n        --block-size ${BLOCK_SIZE:-256}\n        --max-model-len ${MAX_MODEL_LEN:-1048576}\n        --max-num-seqs ${MAX_NUM_SEQS:-6}\n        --max-num-batched-tokens ${MAX_NUM_BATCHED_TOKENS:-8192}\n        --max-cudagraph-capture-size ${MAX_CUDAGRAPH_CAPTURE_SIZE:-36}\n        --gpu-memory-utilization ${GPU_MEMORY_UTILIZATION:-0.88}\n        --enable-prefix-caching\\n        --enable-prompt-tokens-details\n        --enable-flashinfer-autotune\n        --tokenizer-mode deepseek_v4\n        --tool-call-parser deepseek_v4\n        --enable-auto-tool-choice\n        --reasoning-parser deepseek_v4\n        --load-format instanttensor\n        --speculative-config '{\"method\":\"dspark\",\"num_speculative_tokens\":${NUM_SPECULATIVE_TOKENS:-5},\"draft_sample_method\":\"probabilistic\"}'\n        --distributed-executor-backend mp\n        --nnodes ${NODES_TOTAL:-2}\n        --node-rank ${NODE_RANK}\n        --master-addr ${MASTER_ADDR}\n        --master-port ${MASTER_PORT:-25000}\n        ${HEADLESS:+--headless}\n",
  "variables": [
    {
      "key": "VLLM_IMAGE",
      "label": "专属镜像",
      "type": "string",
      "source": "user",
      "default": "fireworks-models/deepseek-v4-flash-0731:0.3.1",
      "picker": "image",
      "help": "DeepSeek-V4-Flash-0731 专属镜像（主流 vLLM v0.26.0 + GB10 overlay）；从已拉取镜像中选择"
    },
    {
      "key": "DSPARK_MODEL",
      "label": "模型",
      "type": "string",
      "source": "user",
      "default": "deepseek-ai/DeepSeek-V4-Flash-0731",
      "required": true,
      "picker": "model",
      "help": "从已下载模型中选择（控制平面下载后分发到各节点 HF 缓存，镜像离线加载）"
    },
    {
      "key": "SERVED_MODEL_NAME",
      "label": "对外服务名",
      "type": "string",
      "source": "user",
      "default": "deepseek-v4-flash-0731"
    },
    {
      "key": "VLLM_PORT",
      "label": "vLLM API 端口",
      "type": "int",
      "source": "user",
      "default": "8000",
      "help": "健康检查将轮询 head 节点该端口的 /v1/models"
    },
    {
      "key": "KV_CACHE_DTYPE",
      "label": "KV cache 量化类型",
      "type": "string",
      "source": "user",
      "default": "nvfp4_ds_mla",
      "help": "DS-MLA 4-bit KV（已验证 1M 上下文）；nvfp4_ds_mla 推荐，fp8_ds_mla 可用"
    },
    {
      "key": "MAX_MODEL_LEN",
      "label": "最大上下文长度",
      "type": "int",
      "source": "user",
      "default": "1048576"
    },
    {
      "key": "MAX_NUM_SEQS",
      "label": "最大并发序列数",
      "type": "int",
      "source": "user",
      "default": "6",
      "help": "ref1/ref2 内存形状；capture≈seqs×(MTP+1)"
    },
    {
      "key": "MAX_NUM_BATCHED_TOKENS",
      "label": "单批最大 token 数",
      "type": "int",
      "source": "user",
      "default": "8192"
    },
    {
      "key": "GPU_MEMORY_UTILIZATION",
      "label": "GPU 显存利用率",
      "type": "float",
      "source": "user",
      "default": "0.88",
      "help": "1M 上下文需 ≥0.88（DeepGEMM 栈权重占用；0.80 仅 b12x 栈可行）"
    },
    {
      "key": "BLOCK_SIZE",
      "label": "KV 缓存 block 大小",
      "type": "int",
      "source": "user",
      "default": "256"
    },
    {
      "key": "MAX_CUDAGRAPH_CAPTURE_SIZE",
      "label": "最大 CUDA Graph 捕获页",
      "type": "int",
      "source": "user",
      "default": "36",
      "help": "= max_num_seqs × (num_speculative_tokens + 1)，6×6=36"
    },
    {
      "key": "NUM_SPECULATIVE_TOKENS",
      "label": "DSpark 投机 token 数",
      "type": "int",
      "source": "user",
      "default": "5"
    },
    {
      "key": "TENSOR_PARALLEL_SIZE",
      "label": "张量并行数",
      "type": "int",
      "source": "user",
      "default": "2",
      "min": 2,
      "help": "固定 2（GB10 每机 1 GPU，TP=节点数=2；已按双节点拓扑调优）",
      "max": 2
    },
    {
      "key": "MASTER_ADDR",
      "label": "Head 集群地址（任务级 head 的 RoCE IP）",
      "type": "string",
      "source": "cluster",
      "auto": "head_roce_ip",
      "required": true,
      "help": "自动填充当前任务的 head 节点 RoCE IP（随任务指定，与集群成员/历史角色无关）"
    },
    {
      "key": "MASTER_PORT",
      "label": "分布式主端口",
      "type": "int",
      "source": "user",
      "default": "25000",
      "help": "分布式主端口（Master 端口，属配方用户变量；head rank0 监听）"
    },
    {
      "key": "NODES_TOTAL",
      "label": "节点总数",
      "type": "int",
      "source": "cluster",
      "auto": "nodes_total",
      "required": true,
      "min": 2,
      "help": "固定 2 节点（head+1 worker，TP=2 双节点配方；节点数/并行度已按此调优）",
      "max": 2
    },
    {
      "key": "NODE_RANK",
      "label": "节点序号",
      "type": "int",
      "source": "node",
      "auto": "node_rank",
      "required": true
    },
    {
      "key": "HEADLESS",
      "label": "Headless（worker 不跑 API server）",
      "type": "string",
      "source": "node",
      "auto": "headless",
      "help": "自动按角色填充：head 空、worker 1（mp 多节点协调必需）"
    },
    {
      "key": "VLLM_HOST_IP",
      "label": "本节点 vLLM 绑定 IP",
      "type": "string",
      "source": "node",
      "auto": "node_roce_ip",
      "help": "各节点 RoCE IP，避免分布式绑定错误地址"
    },
    {
      "key": "NCCL_IB_HCA",
      "label": "RoCE HCA",
      "type": "string",
      "source": "node",
      "auto": "hca",
      "help": "多 HCA 逗号分隔，自动选择全部可用链路"
    },
    {
      "key": "NCCL_SOCKET_IFNAME",
      "label": "NCCL 网络接口",
      "type": "string",
      "source": "node",
      "auto": "netdev",
      "help": "自动解析主用 RoCE 口 netdev"
    },
    {
      "key": "NCCL_IB_GID_INDEX",
      "label": "RoCE GID index",
      "type": "int",
      "source": "node",
      "auto": "gid_index",
      "help": "每节点/HCA 不同且重启漂移，自动解析 RoCEv2 GID"
    }
  ],
  "version": "0.3.1"
}
