{
  "name": "Qwen3.8-27B SGLang DSPARK（单节点）",
  "description": "Qwen3.8-27B-NVFP4 单节点 SGLang 服务：lmsysorg/sglang 镜像、flashinfer 注意力、DSPARK 投机解码（mamba 草稿模型）、FP8 KV、--mamba-full-memory-ratio 11.01（疑似笔误，待验证）。",
  "image": "lmsysorg/sglang:qwen38-27b",
  "compose_template": "services:\n  sglang-qwen:\n    image: ${SGLANG_IMAGE:-lmsysorg/sglang:qwen38-27b}\n    container_name: ${TASK_NAME}-qwen38\n    healthcheck:\n      test: [\"CMD\", \"python3\", \"-c\", \"import urllib.request,sys; sys.exit(0 if urllib.request.urlopen('http://127.0.0.1:${SGLANG_PORT:-30000}/health', timeout=5).status == 200 else 1)\"]\n      interval: 30s\n      timeout: 5s\n      retries: 3\n      start_period: 900s\n    pull_policy: if_not_present\n    entrypoint: []\n    network_mode: host\n    ipc: host\n    shm_size: \"32gb\"\n    ulimits:\n      memlock: -1\n      stack: 67108864\n    gpus: all\n    volumes:\n      # 与源 docker run 一致：宿主 HF 缓存挂到 /root/.cache/huggingface（SGLang 默认 HF_HOME）\n      - ${HF_CACHE:-${HOME}/.cache/huggingface}:/root/.cache/huggingface\n    environment:\n      HF_HOME: /root/.cache/huggingface\n      HF_HUB_OFFLINE: \"1\"  # 模型由管理平台分发到节点缓存，固定离线加载\n      HF_HUB_DISABLE_XET: \"${HF_HUB_DISABLE_XET:-1}\"\n      HF_TOKEN: \"${HF_TOKEN:-}\"  # 受 gating 的模型需 token；从 HF 缓存加载可留空\n      PYTORCH_CUDA_ALLOC_CONF: expandable_segments:True\n    command:\n      - bash\n      - -lc\n      - >\n        export PATH=\"/usr/local/bin:$${PATH:-}\";\n        exec sglang serve ${SGLANG_MODEL:-RadixArk/Qwen3.8-27B-NVFP4}\n        --trust-remote-code\n        --kv-cache-dtype fp8_e4m3\n        --mem-fraction-static ${MEM_FRACTION_STATIC:-0.85}\n        --attention-backend flashinfer\n        --chunked-prefill-size ${CHUNKED_PREFILL_SIZE:-2048}\n        --reasoning-parser qwen3\n        --tool-call-parser qwen3_coder\n        --mamba-full-memory-ratio ${MAMBA_FULL_MEMORY_RATIO:-11.01}\n        --host 0.0.0.0\n        --port ${SGLANG_PORT:-30000}\n        --speculative-algorithm DSPARK\n        --speculative-draft-model-path ${SGLANG_DRAFT_MODEL:-RadixArk/Qwen3.8-27B-DSpark}\n        --speculative-draft-attention-backend flashinfer\n        --mamba-radix-cache-strategy extra_buffer_lazy\n        --mamba-ssm-dtype float32\n",
  "variables": [
    {
      "key": "SGLANG_IMAGE",
      "label": "SGLang 镜像",
      "type": "string",
      "source": "user",
      "default": "lmsysorg/sglang:qwen38-27b",
      "picker": "image",
      "help": "从已拉取镜像中选择（控制平面先拉取再分发）",
      "label_en": "SGLang image",
      "help_en": "Pick from pulled images (control plane pulls then distributes)"
    },
    {
      "key": "SGLANG_MODEL",
      "label": "模型",
      "type": "string",
      "source": "user",
      "default": "RadixArk/Qwen3.8-27B-NVFP4",
      "required": true,
      "picker": "model",
      "help": "从已下载模型中选择（控制平面下载后分发到各节点缓存）",
      "label_en": "Model",
      "help_en": "Pick from downloaded models (control plane downloads and distributes)"
    },
    {
      "key": "SGLANG_DRAFT_MODEL",
      "label": "DSpark 草稿模型",
      "type": "string",
      "source": "user",
      "default": "RadixArk/Qwen3.8-27B-DSpark",
      "help": "DSpark 投机解码的 mamba 草稿模型路径（需已分发到节点）",
      "label_en": "DSpark draft model",
      "help_en": "Mamba draft model path for DSpark speculative decoding (must be distributed)"
    },
    {
      "key": "SGLANG_PORT",
      "label": "SGLang API 端口",
      "type": "int",
      "source": "user",
      "default": "30000",
      "label_en": "SGLang API port"
    },
    {
      "key": "MEM_FRACTION_STATIC",
      "label": "静态显存占比",
      "type": "float",
      "source": "user",
      "default": "0.85",
      "help": "--mem-fraction-static：为 KV/activations 预留的静态显存比例（源命令 0.85）",
      "label_en": "Static memory fraction",
      "help_en": "--mem-fraction-static: static GPU memory fraction reserved (source 0.85)"
    },
    {
      "key": "CHUNKED_PREFILL_SIZE",
      "label": "Chunked prefill 大小",
      "type": "int",
      "source": "user",
      "default": "2048",
      "label_en": "Chunked prefill size"
    },
    {
      "key": "MAMBA_FULL_MEMORY_RATIO",
      "label": "Mamba 全显存比例",
      "type": "float",
      "source": "user",
      "default": "11.01",
      "help": "疑似错误：源命令为 11.01，但该值>1 不合理，很可能是 0.1101（即 11.01%）或 0.11 的笔误；请按 SGLang 文档/实测确认",
      "label_en": "Mamba full memory ratio",
      "help_en": "Suspicious: source is 11.01 but a ratio >1 is invalid; likely 0.1101 (=11.01%) or 0.11 — verify against SGLang docs/tests"
    },
    {
      "key": "HF_TOKEN",
      "label": "HuggingFace Token",
      "type": "string",
      "source": "user",
      "default": "",
      "help": "受 gating 的模型授权 token；模型已由管理平台分发到缓存时通常可留空",
      "label_en": "HuggingFace token",
      "help_en": "Auth token for gated models; usually empty when the model is pre-distributed to the cache"
    }
  ],
  "version": "1.0.0",
  "nodes": 1,
  "name_en": "Qwen3.8-27B SGLang DSPARK (single node)",
  "description_en": "Single-node SGLang serving for Qwen3.8-27B-NVFP4: lmsysorg/sglang image, flashinfer attention, DSPARK speculation (mamba draft model), FP8 KV, --mamba-full-memory-ratio 11.01 (suspected typo, to verify)."
}
